<?xml version="1.0" encoding="UTF-8"?>

<devices xmlns:xsi="http://www.w3.org/2001/XMLSchema-instance"
xsi:noNamespaceSchemaLocation="schema.xsd">
	<ram>
		<name>PC10600</name>
		<origin>USA</origin>
		<manufacturer>Transcend</manufacturer>
		<price>11740</price>
		<critical>true</critical>
		<frequency>1333 Mhz</frequency>
		<memory_size>8192</memory_size>
		<type>DDR3</type>

	</ram>
	
	<cpu>
		<name>Core i3 3240</name>
		<origin>USA</origin>
		<manufacturer>Intel</manufacturer>
		<price>12350</price>
		<critical>true</critical>
		<frequency>3400Mhz</frequency>
		<number_of_cores>2</number_of_cores>
		<number_of_threads>4</number_of_threads>
		<socket>LGA1155</socket>
		<cache_size>2</cache_size>
	</cpu>

	<ram>
		<name> PC6400</name>
		<origin>Japan</origin>
		<manufacturer>Kingmax</manufacturer>
		<price>11740</price>
		<critical>true</critical>
		<frequency>1000 Mhz</frequency>
		<memory_size>2048</memory_size>
		<type>DDR2</type>
	</ram>

	<storage>
		<name>Some disk name</name>
		<origin>USA</origin>    
		<manufacturer>Transcend</manufacturer>
		<price>8430</price>
		<critical>true</critical>
		<capacity>750GB</capacity>
		<transfer_rate>1.4 Gbps</transfer_rate>
		<type>HDD</type>
		
	</storage>
	
	<peripheral>
	    <name>Officejet 7110WF</name>
	    <origin>USA</origin>
	    <manufacturer>HP</manufacturer>
	    <price>35626</price>
	    <critical>false</critical>
	    <group>Output</group>
	</peripheral>
	
</devices>